{
  "scenario_id": "manufacturing-expired-s2-current-claim-v1",
  "evaluation_time": "2026-07-17T00:00:00Z",
  "identity_continuity": "UNKNOWN",
  "package_integrity": "UNKNOWN",
  "package_health_status": "UNKNOWN",
  "historical_record_status": "UNKNOWN",
  "claim_support": "UNKNOWN",
  "claim_truth": "NOT_DETERMINED",
  "fraud_assessment": "UNKNOWN",
  "evidence_assessment": [],
  "missing_support": [],
  "risk_gaps": [],
  "next_checks": [],
  "artifact_refs": [],
  "final_policy_decision": "EXTERNAL_REQUIRED",
  "summary": ""
}
